{"$schema":"https://json-schema.org/draft/2020-12/schema","$id":"urn:montecarlo:calculation-sketch:1","title":"MonteCarlo calculation request sketch v1 (draft; semantic validation also required)","$defs":{"MoneyCents":{"type":"string","pattern":"^(0|[1-9][0-9]{0,18}|-[1-9][0-9]{0,18})$","description":"Exact cents; semantic validator enforces symmetric int64 range excluding INT64_MIN."},"PositiveMoneyCents":{"type":"string","pattern":"^[1-9][0-9]{0,18}$","description":"Positive cents, <=9223372036854775807; enforce bound semantically."},"Account":{"type":"object","properties":{"id":{"type":"string","format":"uuid"},"name":{"type":"string","maxLength":120},"kind":{"enum":["checking","savings","cash","credit"]},"currency":{"const":"USD"},"posted_balance_cents":{"$ref":"#/$defs/MoneyCents"},"pending_outflow_hold_cents":{"type":"string","pattern":"^(0|[1-9][0-9]{0,18})$"},"reconciliation":{"enum":["confirmed","unconfirmed","discrepant"]}},"required":["id","name","kind","currency","posted_balance_cents","pending_outflow_hold_cents","reconciliation"],"additionalProperties":false},"Transaction":{"type":"object","properties":{"id":{"type":"string","format":"uuid"},"account_id":{"type":"string","format":"uuid"},"amount_cents":{"$ref":"#/$defs/MoneyCents"},"effective_date":{"type":"string","format":"date"},"kind":{"enum":["income","expense","adjustment","opening","transfer","refund","fee","interest"]},"clearing_status":{"enum":["pending","posted","voided"]},"category_id":{"anyOf":[{"type":"string","format":"uuid"},{"type":"null"}]},"transfer_id":{"anyOf":[{"type":"string","format":"uuid"},{"type":"null"}]}},"required":["id","account_id","amount_cents","effective_date","kind","clearing_status","category_id","transfer_id"],"additionalProperties":false},"Recurrence":{"type":"object","properties":{"kind":{"enum":["once","weekly","biweekly","semimonthly","monthly","every2months","quarterly","yearly"]},"anchor_date":{"type":"string","format":"date"},"month_day":{"type":["integer","null"],"minimum":1,"maximum":31},"semimonthly_days":{"enum":[null,[1,15],[15,"EOM"]]},"month_end_policy":{"const":"clamp_preserve_anchor"}},"required":["kind","anchor_date","month_day","semimonthly_days","month_end_policy"],"additionalProperties":false},"Income":{"type":"object","properties":{"id":{"type":"string","format":"uuid"},"account_id":{"type":"string","format":"uuid"},"name":{"type":"string"},"amount_cents":{"$ref":"#/$defs/PositiveMoneyCents"},"recurrence":{"$ref":"#/$defs/Recurrence"}},"required":["id","account_id","name","amount_cents","recurrence"],"additionalProperties":false},"Bill":{"type":"object","properties":{"id":{"type":"string","format":"uuid"},"account_id":{"type":"string","format":"uuid"},"name":{"type":"string"},"amount_cents":{"$ref":"#/$defs/PositiveMoneyCents"},"recurrence":{"$ref":"#/$defs/Recurrence"},"category_id":{"anyOf":[{"type":"string","format":"uuid"},{"type":"null"}]}},"required":["id","account_id","name","amount_cents","recurrence","category_id"],"additionalProperties":false},"Occurrence":{"type":"object","properties":{"id":{"type":"string","format":"uuid"},"schedule_id":{"type":"string","format":"uuid"},"nominal_date":{"type":"string","format":"date"},"effective_date":{"type":"string","format":"date"},"amount_cents":{"$ref":"#/$defs/PositiveMoneyCents"},"state":{"enum":["open","payment_pending","paid","skipped","legacy_settled_unknown"]},"settlement_transaction_id":{"anyOf":[{"type":"string","format":"uuid"},{"type":"null"}]}},"required":["id","schedule_id","nominal_date","effective_date","amount_cents","state","settlement_transaction_id"],"additionalProperties":false},"Debt":{"type":"object","properties":{"id":{"type":"string","format":"uuid"},"account_id":{"type":"string","format":"uuid"},"kind":{"enum":["installment","revolving"]},"model":{"const":"monthly_simple_v1"},"balance_cents":{"type":"string","pattern":"^(0|[1-9][0-9]{0,18})$"},"apr_bps":{"type":"integer","minimum":0,"maximum":100000},"minimum_cents":{"$ref":"#/$defs/PositiveMoneyCents"},"minimum_bps":{"type":"integer","minimum":0,"maximum":10000}},"required":["id","account_id","kind","model","balance_cents","apr_bps","minimum_cents","minimum_bps"],"additionalProperties":false},"Event":{"type":"object","properties":{"id":{"type":"string","format":"uuid"},"account_id":{"type":"string","format":"uuid"},"occurrence_id":{"anyOf":[{"type":"string","format":"uuid"},{"type":"null"}]},"date":{"type":"string","format":"date"},"amount_cents":{"$ref":"#/$defs/MoneyCents"},"kind":{"enum":["income","bill","purchase","transfer"]},"phase":{"enum":["known_before_debits","unknown_debit","unknown_credit","known_after_credits"]}},"required":["id","account_id","occurrence_id","date","amount_cents","kind","phase"],"additionalProperties":false},"ScenarioOperation":{"type":"object","properties":{"operation_id":{"type":"string","format":"uuid"},"kind":{"enum":["add_purchase","override_income_occurrence","move_bill_occurrence","add_transfer","change_reserve","extra_debt_payment"]},"target_id":{"anyOf":[{"type":"string","format":"uuid"},{"type":"null"}]},"account_id":{"type":"string","format":"uuid"},"to_account_id":{"anyOf":[{"type":"string","format":"uuid"},{"type":"null"}]},"date":{"type":"string","format":"date"},"amount_cents":{"anyOf":[{"$ref":"#/$defs/PositiveMoneyCents"},{"type":"null"}]}},"required":["operation_id","kind","target_id","account_id","to_account_id","date","amount_cents"],"additionalProperties":false},"Simulation":{"type":"object","properties":{"model_version":{"const":"manual_discrete_v1"},"runs":{"type":"integer","minimum":1,"maximum":5000},"seed":{"type":"string","pattern":"^[0-9]+$"},"income_variation_bps":{"type":"object","properties":{"low":{"type":"integer","minimum":-10000,"maximum":100000},"high":{"type":"integer","minimum":-10000,"maximum":100000}},"required":["low","high"],"additionalProperties":false},"shock_probability":{"type":"object","properties":{"numerator":{"type":"integer","minimum":0},"denominator":{"type":"integer","minimum":1}},"required":["numerator","denominator"],"additionalProperties":false},"shock_amount_cents":{"type":"string","pattern":"^(0|[1-9][0-9]{0,18})$"},"include_daily":{"type":"boolean"}},"required":["model_version","runs","seed","income_variation_bps","shock_probability","shock_amount_cents","include_daily"],"additionalProperties":false},"Snapshot":{"type":"object","properties":{"ledger_id":{"type":"string","format":"uuid"},"revision":{"type":"string","pattern":"^[0-9]+$"},"accounts":{"type":"array","items":{"$ref":"#/$defs/Account"}},"events":{"type":"array","items":{"$ref":"#/$defs/Event"}},"coverage":{"enum":["complete","partial","unknown"]}},"required":["ledger_id","revision","accounts","events","coverage"],"additionalProperties":false}},"type":"object","properties":{"contract_version":{"const":"1.0.0-draft.1"},"profile":{"const":"forecast-projection-v1"},"as_of":{"type":"string","format":"date"},"end_exclusive":{"type":"string","format":"date"},"timezone":{"type":"string","minLength":1},"account_ids":{"type":"array","items":{"type":"string","format":"uuid"}},"snapshot":{"$ref":"#/$defs/Snapshot"},"reserve_cents":{"type":"string","pattern":"^(0|[1-9][0-9]{0,18})$"},"scenarios":{"type":"array","items":{"type":"object","properties":{"id":{"type":"string","format":"uuid"},"operations":{"type":"array","items":{"$ref":"#/$defs/ScenarioOperation"}}},"required":["id","operations"],"additionalProperties":false}},"simulation":{"anyOf":[{"$ref":"#/$defs/Simulation"},{"type":"null"}]}},"required":["contract_version","profile","as_of","end_exclusive","timezone","account_ids","snapshot","reserve_cents","scenarios","simulation"],"additionalProperties":false}
