{"contract_version":"1.0.0-draft.1","profile":"forecast-projection-v1","as_of":"2026-09-29","end_exclusive":"2026-10-03","timezone":"America/Chicago","account_ids":["00000000-0000-4000-8000-000000000002"],"snapshot":{"ledger_id":"00000000-0000-4000-8000-000000000001","revision":"7","accounts":[{"id":"00000000-0000-4000-8000-000000000002","name":"Synthetic checking","kind":"checking","currency":"USD","posted_balance_cents":"100000","pending_outflow_hold_cents":"10000","reconciliation":"confirmed"}],"events":[{"id":"00000000-0000-4000-8000-000000000003","account_id":"00000000-0000-4000-8000-000000000002","occurrence_id":"00000000-0000-4000-8000-000000000004","date":"2026-09-30","amount_cents":"-40000","kind":"bill","phase":"unknown_debit"},{"id":"00000000-0000-4000-8000-000000000005","account_id":"00000000-0000-4000-8000-000000000002","occurrence_id":"00000000-0000-4000-8000-000000000006","date":"2026-10-02","amount_cents":"80000","kind":"income","phase":"unknown_credit"}],"coverage":"complete"},"reserve_cents":"10000","scenarios":[{"id":"00000000-0000-4000-8000-000000000007","operations":[{"operation_id":"00000000-0000-4000-8000-000000000008","kind":"add_purchase","target_id":null,"account_id":"00000000-0000-4000-8000-000000000002","to_account_id":null,"date":"2026-09-29","amount_cents":"30000"}]}],"simulation":null}
